[{"eventID":"pokemon-go-tour-kalos-tainan-2026","name":"Pokémon GO Tour: Kalos - Tainan 2026","eventType":"pokemon-go-tour","heading":"Pokemon Go Tour","image":"https://cdn.leekduck.com/assets/img/events/article-images/2026/2026-02-20-pokemon-go-tour-kalos-tainan-2026/pokemon-go-tour-kalos-tainan-2026.jpg","start":"2026-02-20T01:00:00.000Z","end":"2026-02-22T09:00:00.000Z"},{"eventID":"mega-night-pokemon-go-tour-kalos-tainan-2026","name":"Mega Night at Pokémon GO Tour: Kalos - Tainan 2026","eventType":"pokemon-go-tour","heading":"Pokemon Go Tour","image":"https://cdn.leekduck.com/assets/img/events/article-images/2026/2026-02-20-mega-night-pokemon-go-tour-kalos-tainan-2026/mega-night-pokemon-go-tour-kalos-tainan-2026.jpg","start":"2026-02-20T09:00:00.000Z","end":"2026-02-22T11:00:00.000Z"},{"eventID":"pokemon-go-tour-kalos-los-angeles-2026","name":"Pokémon GO Tour: Kalos - Los Angeles 2026","eventType":"pokemon-go-tour","heading":"Pokemon Go Tour","image":"https://cdn.leekduck.com/assets/img/events/article-images/2026/2026-02-20-pokemon-go-tour-kalos-los-angeles-2026/pokemon-go-tour-kalos-los-angeles-2026.jpg","start":"2026-02-20T17:00:00.000Z","end":"2026-02-23T01:00:00.000Z"},{"eventID":"mega-night-pokemon-go-tour-kalos-los-angeles-2026","name":"Mega Night at Pokémon GO Tour: Kalos - Los Angeles 2026","eventType":"pokemon-go-tour","heading":"Pokemon Go Tour","image":"https://cdn.leekduck.com/assets/img/events/article-images/2026/2026-02-20-mega-night-pokemon-go-tour-kalos-los-angeles-2026/mega-night-pokemon-go-tour-kalos-los-angeles-2026.jpg","start":"2026-02-21T02:00:00.000Z","end":"2026-02-23T04:00:00.000Z"},{"eventID":"pokemon-go-tour-kalos-global-2026","name":"Pokémon GO Tour: Kalos - Global 2026","eventType":"pokemon-go-tour","heading":"Pokemon Go Tour","image":"https://cdn.leekduck.com/assets/img/events/article-images/2026/2026-02-28-pokemon-go-tour-kalos-global-2026/pokemon-go-tour-kalos-global-2026.jpg","start":"2026-02-28T10:00:00.000","end":"2026-03-01T18:00:00.000"}]