[{"eventID":"dynamax-ho-oh-max-battle-weekend","name":"Dynamax Ho-Oh Max Battle Weekend","eventType":"max-battles","heading":"Max Battles","image":"https://cdn.leekduck.com/assets/img/events/article-images/2026/2026-01-31-dynamax-ho-oh-max-battle-weekend/dynamax-ho-oh-max-battle-weekend.jpg?v2","start":"2026-01-31T06:00:00.000","end":"2026-02-01T21:00:00.000","pokemon":[{"name":"Ho-Oh","image":"https://cdn.leekduck.com/assets/img/pokemon_icons/pokemon_icon_250_00.png","canBeShiny":true,"imageWidth":256,"imageHeight":256,"imageType":"png","source":"featured"}],"bonuses":["The following bonuses will be active during the event."]},{"eventID":"max-battle-day-february-2026","name":"Max Battle Day","eventType":"max-battles","heading":"Max Battles","image":"https://cdn.leekduck.com/assets/img/events/events-default-img.jpg","start":"2026-02-15T14:00:00.000","end":"2026-02-15T17:00:00.000"},{"eventID":"max-battle-day-march-2026","name":"Max Battle Day","eventType":"max-battles","heading":"Max Battles","image":"https://cdn.leekduck.com/assets/img/events/events-default-img.jpg","start":"2026-03-28T14:00:00.000","end":"2026-03-28T17:00:00.000"},{"eventID":"max-battle-day-april-2026","name":"Max Battle Day","eventType":"max-battles","heading":"Max Battles","image":"https://cdn.leekduck.com/assets/img/events/events-default-img.jpg","start":"2026-04-25T14:00:00.000","end":"2026-04-25T17:00:00.000"}]