[{"eventID":"shadow-cresselia-in-shadow-raids-january-february-2026","name":"Shadow Cresselia in Shadow Raids","eventType":"raid-battles","heading":"Raid Battles","image":"https://cdn.leekduck.com/assets/img/events/events-default-img.jpg","start":"2026-01-02T06:00:00.000","end":"2026-02-01T22:00:00.000"},{"eventID":"mega-ampharos-in-mega-raids-january-2026","name":"Mega Ampharos in Mega Raids","eventType":"raid-battles","heading":"Raid Battles","image":"https://cdn.leekduck.com/assets/img/events/mega-default.jpg","start":"2026-01-25T10:00:00.000","end":"2026-02-04T10:00:00.000"},{"eventID":"tornadus-incarnate-forme-in-5-star-raid-battles-january-2026","name":"Tornadus (Incarnate Forme) in 5-star Raid Battles","eventType":"raid-battles","heading":"Raid Battles","image":"https://cdn.leekduck.com/assets/img/events/events-default-img.jpg","start":"2026-01-25T10:00:00.000","end":"2026-02-04T10:00:00.000"},{"eventID":"shadow-regigigas-in-shadow-raids-february-march-2026","name":"Shadow Regigigas in Shadow Raids","eventType":"raid-battles","heading":"Raid Battles","image":"https://cdn.leekduck.com/assets/img/events/events-default-img.jpg","start":"2026-02-01T06:00:00.000","end":"2026-03-04T22:00:00.000"},{"eventID":"landorus-incarnate-forme-in-5-star-raid-battles-february-2026","name":"Landorus (Incarnate Forme) in 5-star Raid Battles","eventType":"raid-battles","heading":"Raid Battles","image":"https://cdn.leekduck.com/assets/img/events/landorus-raids-mar2020.jpg","start":"2026-02-04T10:00:00.000","end":"2026-02-16T10:00:00.000"},{"eventID":"mega-pidgeot-in-mega-raids-february-2026","name":"Mega Pidgeot in Mega Raids","eventType":"raid-battles","heading":"Raid Battles","image":"https://cdn.leekduck.com/assets/img/events/mega-default.jpg","start":"2026-02-04T10:00:00.000","end":"2026-02-16T10:00:00.000"},{"eventID":"mega-sableye-in-mega-raids-february-2026","name":"Mega Sableye in Mega Raids","eventType":"raid-battles","heading":"Raid Battles","image":"https://cdn.leekduck.com/assets/img/events/mega-default.jpg","start":"2026-02-16T10:00:00.000","end":"2026-02-21T10:00:00.000"},{"eventID":"solgaleo-in-5-star-raid-battles-february-2026","name":"Solgaleo in 5-star Raid Battles","eventType":"raid-battles","heading":"Raid Battles","image":"https://cdn.leekduck.com/assets/img/events/solgaleo.jpg?v2","start":"2026-02-16T10:00:00.000","end":"2026-02-21T10:00:00.000"},{"eventID":"lunala-in-5-star-raid-battles-february-2026","name":"Lunala in 5-star Raid Battles","eventType":"raid-battles","heading":"Raid Battles","image":"https://cdn.leekduck.com/assets/img/events/lunala.jpg?v2","start":"2026-02-21T10:00:00.000","end":"2026-03-04T10:00:00.000"},{"eventID":"mega-absol-in-mega-raids-february-2026","name":"Mega Absol in Mega Raids","eventType":"raid-battles","heading":"Raid Battles","image":"https://cdn.leekduck.com/assets/img/events/mega-default.jpg","start":"2026-02-21T10:00:00.000","end":"2026-03-04T10:00:00.000"}]